Idiom (Nizaa),Syntactic Structure & Grammatical Form,Figurative Meaning (Contextualized Definition),"Non-Idiomatic Equivalent (Plain, Neutral Rephrasing)",CEFR Level (A1–C2),Usage Contexts,Register and Tone,Cultural Origin or Historical Reference,"Phonetic Transcription (IPA, Nizaa)",First Example Sentence,Second Example Sentence,Third Example Sentence
"Bàà fàà, àŋà fàà.",Fixed clause with parallel structure,Helping others brings help in return.,"If you help others, they will help you.",B1,"daily speech, moral lesson, family advice","proverbial, moral","Common Nizaa proverb from the Mbo plain, used in traditional mediation.",ɓàː fàː | àŋà fàː,"Bàà fàà, àŋà fàà; nàŋa tì sàŋà mùŋà.","Bàà fàà, àŋà fàà; àŋà ɗə̀ nàŋa tì.","Bàà fàà, àŋà fàà; àŋà sàŋà nɔ́."
"Tà kə̀ bàà, mə̀ mùŋà.",Fixed clause with imperative nuance,Patience leads to peace and success.,Be patient and things will be well.,A2,"teaching, counseling, community talk","proverbial, formal",Old Nizaa saying referring to waiting for crop harvests.,tà kə̀ bàː | mə̀ mùŋà,"Tà kə̀ bàà, mə̀ mùŋà; àŋà wə̀ ɗə̀ fàà.","Tà kə̀ bàà, mə̀ mùŋà; àŋà sàŋà nɔ́.","Tà kə̀ bàà, mə̀ mùŋà; nàŋa wə̀ bɔ́ŋ."
"Nàŋa kàà ŋwà, wàà kàà ɗə̀.",Conditional clause structure,"When the sun rises, life begins anew.","When morning comes, work begins.",B2,"literary, philosophical reflection","literary, poetic",Traditional expression symbolizing renewal after the dry season.,nàŋà kàː ŋʷà | wàː kàː ɗə̀,"Nàŋa kàà ŋwà, wàà kàà ɗə̀ bɔ́ŋ.","Nàŋa kàà ŋwà, wàà kàà ɗə̀; àŋà fàà bɔ́ŋ.","Nàŋa kàà ŋwà, wàà kàà ɗə̀ nɔ́."
"Àŋà sàŋà ŋwà, mə̀ ɗə̀.",Declarative with subject-focus agreement,A joyful person always speaks truth.,Honest people speak truthfully.,C1,"family, moral talk, counseling","colloquial, moral",Originates from oral narratives emphasizing joy and truth.,àŋà sàŋà ŋʷà | mə̀ ɗə̀,"Àŋà sàŋà ŋwà, mə̀ ɗə̀; nàŋa fàà bɔ́ŋ.","Àŋà sàŋà ŋwà, mə̀ ɗə̀ nɔ́.","Àŋà sàŋà ŋwà, mə̀ ɗə̀; àŋà wə̀ fàà bɔ́ŋ."
"Mə̀ ɗə̀ ɗàà, àŋà ɗə̀ nàŋa.",Compound cause-effect clause,What you plant today grows tomorrow.,Your actions determine your results.,C1,"agriculture, work ethics, tradition","proverbial, reflective",Ancestral wisdom from farming communities in Ndop plain.,mə̀ ɗə̀ ɗàː | àŋà ɗə̀ nàŋà,"Mə̀ ɗə̀ ɗàà, àŋà ɗə̀ nàŋa; àŋà sàŋà ŋwà.","Mə̀ ɗə̀ ɗàà, àŋà ɗə̀ nàŋa; àŋà sàŋà ŋwà.","Mə̀ ɗə̀ ɗàà, àŋà ɗə̀ nàŋa nɔ́."
Àŋà wə̀ fàà ŋwà.,Declarative with existential subject,Good actions bring good fortune.,Doing good leads to good results.,B2,"religious sermon, proverbs collection","formal, ethical",Rooted in community rituals of reciprocity and gratitude.,àŋà wə̀ fàː ŋʷà,Àŋà wə̀ fàà ŋwà; nàŋa tì ɗə̀ nɔ́.,"Àŋà wə̀ fàà ŋwà, nàŋa wə̀ bɔ́ŋ.","Àŋà wə̀ fàà ŋwà, nàŋa sàŋà bɔ́ŋ."
Àŋà sàŋà ɗàà nɔ́.,Declarative poetic clause,True joy comes from within.,Happiness depends on your heart.,C1,"storytelling, self-reflection","literary, philosophical",Derived from songs sung during communal work (‘ŋwàŋa’).,àŋà sàŋà ɗàː nɔ́,Àŋà sàŋà ɗàà nɔ́; mə̀ ɗə̀ mùŋà.,"Àŋà sàŋà ɗàà nɔ́, mə̀ ɗə̀ nàŋa tì.","Àŋà sàŋà ɗàà nɔ́, mə̀ ɗə̀ ŋwà."
Nàŋa tì ɗə̀ bɔ́ŋ.,Declarative past-time clause,Yesterday teaches today’s wisdom.,We learn from past experiences.,B2,"education, wisdom literature","formal, historical",Historical teaching in initiation rites and moral instruction.,nàŋà tì ɗə̀ bɔ́ŋ,Nàŋa tì ɗə̀ bɔ́ŋ; àŋà fàà mùŋà.,"Nàŋa tì ɗə̀ bɔ́ŋ, àŋà fàà ŋwà.",Nàŋa tì ɗə̀ bɔ́ŋ; àŋà wə̀ fàà nɔ́.
"Àŋà ɗə̀ mùŋà, àŋà tì.",Coordinated declarative structure,"Where there is peace, life thrives.",Peace makes life better.,B1,"political speech, leadership ethics","formal, reflective",Commonly used by Nizaa elders during peace meetings.,àŋà ɗə̀ mùŋà | àŋà tì,"Àŋà ɗə̀ mùŋà, àŋà tì; àŋà sàŋà ŋwà.","Àŋà ɗə̀ mùŋà, àŋà tì; àŋà wə̀ fàà ŋwà.","Àŋà ɗə̀ mùŋà, àŋà tì; nàŋa fàà ŋwà."
"Mə̀ wə̀ fàà nàŋa, àŋà wə̀ fàà bɔ́ŋ.",Causal compound clause,What you give will return to you someday.,Generosity brings rewards.,C2,"community gatherings, moral instruction","poetic, moral",A proverb used by chiefs to promote fairness and generosity.,mə̀ wə̀ fàː nàŋà | àŋà wə̀ fàː bɔ́ŋ,"Mə̀ wə̀ fàà nàŋa, àŋà wə̀ fàà bɔ́ŋ; nàŋa ɗə̀ mùŋà.","Mə̀ wə̀ fàà nàŋa, àŋà wə̀ fàà bɔ́ŋ; àŋà ɗə̀ ŋwà.","Mə̀ wə̀ fàà nàŋa, àŋà wə̀ fàà bɔ́ŋ; àŋà ɗə̀ ɗàà."
