Idiom (Juhuri),Syntactic Structure & Grammatical Form,Figurative Meaning (Contextualized Definition),"Non-Idiomatic Equivalent (Plain, Neutral Rephrasing)",CEFR Level (A1–C2),Usage Contexts,Register and Tone,Cultural Origin or Historical Reference,"Phonetic Transcription (IPA, Juhuri)",First Example Sentence,Second Example Sentence,Third Example Sentence
"Ду тишо, ду ғуло",Fixed clause; noun phrase with repetition for emphasis,To be caught between two difficult choices,To face two bad options,B2,"Daily speech, moral dilemmas, humor","Colloquial, ironic",Common among Mountain Jews; refers to a shepherd caught between two wolves,"[du tiʃo, du ɣulo]","Мой даг ду тишо, ду ғуло — чо кунем, хамо ғарав вахра!","Ов ду тишо, ду ғуло монде, на хост ми йов, на хост ми лел.","Инт ахло ду тишо, ду ғуло, ва на донад чи гул биравад."
"Шимида хун йок, лекин қалбида оташ аст",Complex clause; contrastive conjunction,A calm exterior hides deep emotion,Someone seems calm but feels deeply inside,C1,"Literature, family, emotions","Poetic, introspective",Derived from folk poetry about emotional restraint in the Caucasus,"[ʃimida xun jok, lekʲin qalbida otaʃ ast]","Шимида хун йок, лекин қалбида оташ аст — ов ҳарчанд хомуш, дил пур оташ.","Модаро дидам, шимида хун йок, лекин қалбида оташ аст.","Шимида хун йок, лекин қалбида оташ аст — маънои сабр ва ғам."
Хуни гарми саре наҳапеш,Verb phrase; imperative-like proverb structure,Don’t act rashly when angry,Calm down before making decisions,B1,"Family, advice, education","Moralistic, traditional","Common parental saying in Qırmızı Qəsəbə, reflecting community wisdom",[xuni ɡarmi sare nahapeʃ],Бова гуйе: «Хуни гарми саре наҳапеш!»,Инт хато карди — хуни гарми саре наҳапеш!,"Ҳар кор пеш аз фикр кардан, хуни гарми саре наҳапеш."
Ҳамуро дар об гузарондан,Infinitive clause; transitive idiom,To deceive someone cleverly,To trick or fool someone,B2,"Politics, humor, storytelling","Ironic, sarcastic",Based on an old saying about bakers testing patience with dough,[hɑmuro dar ob guzarondan],Инт ов ҳамуро дар об гузаронд!,"На ди, ӯ ҳамуро дар об гузаронд ва хандид.","Бова мегуйе, ки ӯ ҳамуро дар об гузаронд — аҳли ҳилла аст."
Гав тири малика ба саг расид,Past tense clause; ironic statement,An undeserving person got lucky,Someone got something they didn’t deserve,C1,"Humor, sarcasm, politics","Ironic, colloquial",Mountain Jewish satire mocking misplaced rewards,[ɡav tiri malikɑ ba saɡ rasid],Гав тири малика ба саг расид — олам ба таг гашт!,"На гу, гав тири малика ба саг расид, ва ҳама хандиданд.","Инт хабари нав, гав тири малика ба саг расид."
"Бе шавқ, бе шири чой",Noun phrase with parallel structure,Without enthusiasm or life,Lacking energy or passion,A2,"Daily speech, humor","Colloquial, light-hearted",Tea is central to Juhuri hospitality; idiom compares dullness to plain tea,"[be ʃavq, be ʃiri tʃoj]","Инт суҳбат бе шавқ, бе шири чой буд.","Ов бе шавқ, бе шири чой гап мезад.","Маҳфил бе шавқ, бе шири чой, на хуш набуд."
Қалби шикаста ҳам оҳанг дорад,Declarative clause; metaphorical subject,Even a broken person has beauty or strength,Broken people still have value,C2,"Literature, moral reflection, motivation","Poetic, reflective",Derived from oral poetry of the Caucasus,[qalbi ʃikasta ham ohanɡ dorad],Қалби шикаста ҳам оҳанг дорад — ҳар дард оҳанг дорад.,"Бова гуфт, қалби шикаста ҳам оҳанг дорад.",Қалби шикаста ҳам оҳанг дорад — ҳикмати зиндаги.
"Бе нон, бе номус намешавад",Negative clause; double negation proverb,Poverty threatens dignity,One cannot live with dignity without sustenance,B2,"Proverbs, moral speech, politics","Proverbial, serious",Reflects Jewish mountain values about dignity and livelihood,"[be non, be nomus nameʃavad]","Бе нон, бе номус намешавад — ҳақиқат аст.","Модар гуфт: «Бе нон, бе номус намешавад».","Ҳар кас донад, бе нон, бе номус намешавад."
Ҳар гул худашро ба шамол медиҳад,Declarative clause; reflexive structure,Everyone shows their true colors eventually,True character reveals itself with time,C1,"Philosophical, family, advice","Reflective, moralistic",Nature-based metaphor common in Juhuri oral storytelling,[har ɡul xudaʃro ba ʃamol medihad],Ҳар гул худашро ба шамол медиҳад — вақт ҳама чиз нишон медихад.,"Инт рост гуфт, ҳар гул худашро ба шамол медиҳад.",Ҳар гул худашро ба шамол медиҳад — фалсафаи ҳаёт.
Аз дуқон оби сард намегирад,Negative clause; conditional nuance,Lazy person never succeeds,"Without effort, nothing is gained",B1,"Workplace, daily life, education","Proverbial, motivational",Old Juhuri expression tied to trade and labor ethics,[az duqon obi sard nameɡirad],Аз дуқон оби сард намегирад — кор кун то бихӯри.,"Ҳар ки танбал аст, аз дуқон оби сард намегирад.",Аз дуқон оби сард намегирад — қавли қадим.
