Idiom (Ecuadorian Spanish),Syntactic Structure & Grammatical Form,Figurative Meaning (Contextualized Definition),"Non-Idiomatic Equivalent (Plain, Neutral Rephrasing)",CEFR Level (A1–C2),Usage Contexts,Register and Tone,Cultural Origin or Historical Reference,"Phonetic Transcription (IPA, Ecuadorian Spanish)",First Example Sentence,Second Example Sentence,Third Example Sentence
Estar hecho un cuy,"Locución verbal, estructura fija","Estar muy inquieto o nervioso, moviéndose sin parar",Estar muy inquieto o alterado,B1,"Conversación cotidiana, humor","Coloquial, humorístico","Hace referencia a cómo se mueven los cuyes (conejillos de Indias), animales muy comunes en la Sierra ecuatoriana",esˈtaɾ ˈetʃo uŋ ˈkui̯,"Cuando le tocó hablar en público, estaba hecho un cuy.","Desde que llegó la visita, mi hermano está hecho un cuy.",Se puso hecho un cuy esperando la nota del examen.
No comer cuento,"Locución verbal negativa, estructura fija",No dejarse engañar fácilmente,No dejarse convencer con facilidad,B2,"Familia, política, vida urbana","Coloquial, firme","Ampliamente usada en América Latina, pero popularizada en Ecuador como forma de resistencia social",no koˈmeɾ ˈkwento,"Esa señora no come cuento, ya ha visto de todo.",Yo no como cuento con promesas de políticos.,"No comas cuento, ese negocio suena raro."
Estar con la cabeza en otra parte,"Locución verbal, estructura preposicional",Estar distraído o preocupado por algo,Estar distraído,A2,"Estudios, familia, relaciones","Neutro, coloquial",Expresión extendida por influencia de contextos escolares y laborales,esˈtaɾ kon la kaˈβesa en ˈotɾa ˈpaɾte,¡Pon atención! Estás con la cabeza en otra parte.,No respondía porque estaba con la cabeza en otra parte.,Siempre estás con la cabeza en otra parte cuando hablamos de dinero.
Estar con el agua hasta el cuello,Locución verbal con preposición,Estar en una situación límite o de apuro,Estar en una situación difícil,B1,"Economía, trabajo, vida cotidiana",Coloquial,Metáfora extendida en el mundo hispano; en Ecuador se usa especialmente para temas económicos,esˈtaɾ kon el ˈaɣwa ˈasta el ˈkuʝo,Este mes estoy con el agua hasta el cuello.,"No puedo salir, estoy con el agua hasta el cuello de trabajo.",Muchos están con el agua hasta el cuello por las deudas.
Se le fue el tren,"Oración impersonal, pasiva refleja",Perdió una oportunidad importante,Perdió la oportunidad,B2,"Amor, trabajo, humor, consejos","Coloquial, irónico",Hace alusión al tren como símbolo de oportunidades fugaces; popular en contextos urbanos,se le fue el tɾen,No le pidió el número y se le fue el tren.,"Si no presentas la tesis, se te va el tren.","Por indeciso, se le fue el tren con ese trabajo."
Ponerle la sal,Locución verbal con pronombre enclítico,Traer mala suerte o estropear algo sin querer,Arruinar algo involuntariamente,C1,"Superstición, vida cotidiana, humor","Coloquial, supersticioso",Relacionado con la creencia de que la sal derramada trae mala suerte; en Ecuador se dice de alguien que 'saló' algo,poˈneɾle la ˈsal,"Le pusiste la sal al partido, desde que llegaste empezaron a perder.","Cada vez que vienes, se va la luz… ¡ya no le pongas la sal!","Mi primo le puso la sal a la cita, todo salió mal."
Hacerse el loco,Verbo pronominal con artículo definido,Fingir no entender o ignorar algo intencionalmente,Ignorar deliberadamente,B2,"Trabajo, familia, relaciones personales","Coloquial, sarcástico",Muy usado en América Latina; en Ecuador es común en discusiones o reclamos,aˈseɾse el ˈloko,Se hizo el loco cuando le preguntaron por el dinero.,"No te hagas el loco, sabemos que viste todo.",Mi jefe se hace el loco con las horas extras.
Tener la lengua larga,Locución verbal con sustantivo figurado,Hablar más de lo debido o revelar secretos,Ser indiscreto al hablar,B1,"Relaciones sociales, chismes, trabajo","Coloquial, crítico",Hace referencia metafórica a la lengua como herramienta para hablar de más,teˈneɾ la ˈleŋɡwa ˈlaɾɣa,"Cuidado con ella, tiene la lengua larga.","Le conté un secreto y ya todos lo saben, ¡qué lengua larga!",A veces tener la lengua larga te mete en problemas.
Irse de bruces,Verbo pronominal reflexivo con complemento adverbial,Fracasar rotundamente en algo que se intentó,Fracasar completamente,C1,"Escuela, negocios, relaciones","Coloquial, expresivo","Se refiere a la caída de bruces (de frente), usada metafóricamente para el fracaso",ˈiɾse de ˈbɾuses,Intentó vender seguros y se fue de bruces.,Me fui de bruces con esa inversión.,"Si no estudias, te vas de bruces en el examen."
Más perdido que cangrejo en fiesta,Comparativa con símil humorístico,Estar completamente desorientado o fuera de lugar,Estar muy desorientado,B2,"Conversación informal, humor","Coloquial, irónico, humorístico","Expresión costeña humorística que usa el símbolo del cangrejo, típico de la gastronomía ecuatoriana",mas peɾˈðiðo ke kaŋˈɡɾexo en ˈfjesta,Llegó al nuevo trabajo más perdido que cangrejo en fiesta.,Estoy más perdido que cangrejo en fiesta en esta clase de cálculo.,Entró al grupo y quedó más perdido que cangrejo en fiesta.
